TITLE	DATES	LOCATION	DESCRIPTION
The Floating World Exhibit	February 11, 2024 - June 30, 2024	Blanton Museum of Art	After centuries of conflict and war, Japan’s Edo period (1603–1868) was a time of peace, stability, and economic growth. Enjoy more than 130 woodblock prints and painted scrolls from one of history’s most vibrant artistic eras.  These “pictures of the floating world” depict the lifestyle, pleasures, and interests of the urban population— from samurais, geishas, and kabuki actors to boat parties, palaces, and lush landscapes.  Not to be missed, this presentation marks the first time the Worcester Art Museum is touring its famed collection of Japanese artworks. The Floating World: Masterpieces of Edo Japan from the Worcester Art Museum will be on view starting February 11, 2024 through June 30, 2024.
The Prom	4/3/2024, 4/4/2024, 4/5/2024, 4/6/2024, 4/7/2024, 4/10/2024, 4/11/2024, 4/12/2024, 4/13/2024, 4/14/2024, 4/18/2024, 4/19/2024, 4/20/2024, 4/21/2024, 4/24/2024, 4/25/2024, 4/26/2024, 4/27/2024, 4/28/2024, 5/8/2024, 5/9/2024, 5/10/2024, 5/11/2024, 5/12/2024	The Topfer at ZACH Theatre	In desperate search of a new stage, four washed-up Broadway stars rally behind a small-town prom facing controversy. As they aim to shine a light on themselves, they encounter a brave girl fighting for her right to bring her girlfriend to the school prom. Nominated for 7 Tony Awards including BEST MUSICAL, The Prom expertly captures the power of love and a powerful message that resonates now more than ever.
This Friday: Saakred + Alejandra Regalado	March 8, 2024 - April 13, 2024	Big Medium	The Projecto’s Brand New Art Gallery Pioneering Experimental Projects by Emerging and Established Artists with a Diverse Selection and a Unique Perspective.  Upcoming March 8 - April 14, 2024: Gallery: Reimagining Aztlán: A Virtual Utopia, A Virtual Playground by Saakred Showroom: Inner Surface by Alejandra Regalado
Texas Eclipse	April 5, 2024 - April 9, 2024	Reveille Peak Ranch	Texas Eclipse 2024 is a once-in-a-lifetime celebration under the Texas sky! Don’t miss your last chance to catch a total solar eclipse in the United States for more than 20 years on April 5-9th, 2024. At over 4 minutes and 20 seconds, this will be one of the longest totality events you can attend.  This experience will feature music, art, space and technology over 4+ days, set in the beautiful Texas Hill Country, just a short drive from Austin, TX. We’ll be joined by thousands of festival lovers and eclipse enthusiasts from all over the world.
Romeo and Juliet	April 5, 2024 - April 27, 2024	The Curtain Theatre	The Baron's Men present Shakespeare's Romeo and Juliet, directed by Lindsay M. Palinsky. Performances are at the Curtain Theatre, Austin's only outdoor Elizabethan style "wooden O" theater on the waterfront in west Austin.  Tickets are $25/general admission, $22/students & seniors. Please contact us at info@thebaronsmen.org for inquiries about group (10+) or educational rates.
TORRES w/ Liza Anne	April 5, 2024	Parish	Resound Presents: TORRES w/ Liza Anne at Parish on 4/5 Doors/Show: 7:30pm/8:30pm All Ages
The Secret Sisters	April 5, 2024	The 04 Center	Since their 2010 self-titled debut, The Secret Sisters have brought their spellbinding harmonies to songs that untangle the thorniest aspects of life and love and womanhood. In the making of their new album, Mind, Man, Medicine, Alabama-bred siblings Laura Rogers and Lydia Slagle found their songwriting transformed by a newfound sense of self-reliance and equanimity, threading their lyrics with hard-won insight into the complexities of motherhood, commitment, compassion, and self-preservation in an endlessly chaotic world. Centered on a kaleidoscopic sound that boldly blurs the edges of country-folk, the duo’s fifth full-length ultimately confronts many of modern life’s harshest challenges while leading the listener toward a more open-hearted state of mind.  “In our previous records there was a feeling that we had something to prove, but now we’re leaning toward a place of peaceful acceptance and trying to stay immersed in the present,” says Slagle, noting that their shared experience in parenting young children greatly informed that shift in perspective. “There are definitely still moments of frustration and anger on this album, but there’s also a little more light,” Rogers adds. “I think a lot of that came from getting older, and from letting go of the pressure we put on ourselves in the past. We finally reached the point of saying, ‘Let’s just write the songs honestly as we can, and trust that they’ll reach whoever they’re meant to reach.’”  The follow-up to Saturn Return—their 2020 Grammy-nominated LP co-produced by Brandi Carlile and lavishly praised by the likes of Rolling Stone—Mind, Man, Medicine finds The Secret Sisters co-producing alongside Ben Tanner (Alabama Shakes, St. Paul & the Broken Bones) and John Paul White (formerly of Grammy-winning duo the Civil Wars). “On Saturn Return we’d gotten much more confident as far as directing the sound of the record and knowing how to capture our voices in the most honest way, so it felt like the right time for our first foray into production,” says Rogers. The latest in a series of critically lauded releases, the album came to life at FAME Studios (the historic spot in their hometown of Muscle Shoals) and at Sun Drop Sound in nearby Florence, with contributions from such esteemed musicians as Alabama Shakes bassist Zac Cockrell and legendary multi-instrumentalist Larry Campbell (Paul Simon, Willie Nelson, Levon Helm).
Two Births and the Afterlife Exhibit	January 11, 2024 - April 20, 2024	George Washington Carver Museum, Cultural & Genealogy Center	Two Births and the Afterlife features a new body of work by Milwaukee-based artist Aimée M. Everett, exploring the profound transformations experienced during childbirth and the subsequent journey of self-discovery into motherhood. The artist delves into the poignant realization that with every birth, there exists a simultaneous death—the departure of one's former identity to welcome a new, evolved self. Everett vividly portrays the overwhelming joy and simultaneous dissolution of familiar aspects of identity. This body of work—employing abstraction, minimalistic line-making, saturated colors, and melodic compositions—serves as an emotional odyssey.    The months following the birth unfolded into a challenging transition period.
Under the Oaks Concert - Ruthie Craft	April 5, 2024	French Legation State Historic Site	Join us April 5th for the second night of our 2024 Under the Oaks concert series! Come out to the French Legation to enjoy a performance from home grown Austinite San Gabriel.  Gates open 5:00 p.m. Music from 6:00pm – 7:30 p.m. Pack a picnic and enjoy the evening air. Free drinks provided by our friends at Live Oak Brewing.  Upcoming dates:  March 22nd – Guy Forsyth, @guyforsythband April 5th – San Gabriel, @sangabrielmusic May 3rd – Ruthie Craft, @ruthiecraft
Under the Oaks Concert - San Gabriel	April 5, 2024	French Legation State Historic Site	Join us April 5th for the second night of our 2024 Under the Oaks concert series! Come out to the French Legation to enjoy a performance from home grown Austinite San Gabriel.  Gates open 5:00 p.m. Music from 6:00pm – 7:30 p.m. Pack a picnic and enjoy the evening air. Free drinks provided by our friends at Live Oak Brewing.  Upcoming dates: March 22nd – Guy Forsyth, @guyforsythband April 5th – San Gabriel, @sangabrielmusic May 3rd – Ruthie Craft, @ruthiecraft
Wind Rose in Austin	April 5, 2024	Come and Take It Live	Embark on an epic journey with Wind Rose in Austin on April 5, 2024! This Italian power metal band is renowned for their dwarven-themed music and anthems like "Diggy Diggy Hole" and "Drunken Dwarves." As part of their 2024 tour, Wind Rose promises a night of thunderous riffs, folk-inspired melodies, and tales of fantasy and adventure. Known for their energetic live performances and unique blend of metal and folk elements, Wind Rose is a must-see for fans of epic, storytelling-driven music. Don't miss this opportunity to join the dwarven army and experience the power of Wind Rose live!
Wonderful India Festival	April 5, 2024 - April 27, 2024	Artly World	Wonderful India Festival showcases the beauty of India’s traditional arts, music, and dance through a month-long exhibition and series of cultural events featuring local artists, musicians, dancers, and performers.  An art exhibition combined with music and dance performances and cultural celebrations… Experience the wonder of India’s artistic and cultural traditions through exhibition of artwork, music performances, dance recitals, community gatherings and cultural celebrations, and live workshops, lectures, and demonstrations.  Plan Your Visit this April! Open Gallery Hours are scheduled at designated times through the week (recurring weekly on Thursdays, Fridays, and Saturdays from 5p to 8p), along with curated cultural events and performances on the weekends. With the exception of select scheduled events, we operate this festival on a pay-what-you-can donation model to ensure accessibility. See complete details about the schedule and lineup of artists and performers, visit the Wonderful India Festival website at www.WonderfulIndiaFestival.com.  Don’t miss this amazing opportunity to experience India here in Austin through community, celebration, and performance!
A Gentle Seed: New Artworks from Ghana	March 8, 2024 - April 20, 2024	McLennon Pen Co. Gallery	Public Opening Reception: Friday, March 8th, 6–9 PM  McLennon Pen Co. Gallery is thrilled to announce a group show of paintings by artists from Ghana, including Selorm Amekorfia, Theresah Ankomah, Kwabena Fordjour, Salihu Mohammed, Daniel Tetteh Nartey, Azmina-Toure, and Rufai Zakari.
A Year With Frog and Toad	3/17/2024, 3/23/2024, 3/24/2024, 3/30/2024, 4/6/2024, 4/7/2024, 4/13/2024, 4/14/2024, 4/20/2024, 4/21/2024, 4/27/2024, 4/28/2024, 5/5/2024, 5/11/2024, 5/12/2024	The Kleberg at ZACH Theatre	Based on Arnold Lobel’s beloved book, the Tony-nominated musical A Year with Frog and Toad celebrates enduring friendship and life’s lessons as Frog and Toad navigate the changing seasons together, engaging audiences with a charming blend of vaudeville, make-believe, and an enchanting jazzy score that delights the whole family.  Age Recommendation: 3 & up  Happens on the following Dates: Feb 23, 2024, 7:00pm to 8:00pm CST Feb 24, 2024, 2:00pm to 3:00pm CST Mar 2, 2024, 2:00pm to 3:00pm CST Mar 17, 2024, 2:00pm to 3:00pm CST Mar 23, 2024, 2:00pm to 3:00pm CST Mar 24, 2024, 2:00pm to 3:00pm CST Mar 30, 2024, 2:00pm to 3:00pm CST Apr 6, 2024, 2:00pm to 3:00pm CST Apr 7, 2024, 2:00pm to 3:00pm CST Apr 13, 2024, 2:00pm to 3:00pm CST Apr 14, 2024, 2:00pm to 3:00pm CST Apr 20, 2024, 2:00pm to 3:00pm CST Apr 21, 2024, 2:00pm to 3:00pm CST Apr 27, 2024, 2:00pm to 3:00pm CST Apr 28, 2024, 2:00pm to 3:00pm CST May 5, 2024, 2:00pm to 3:00pm CST May 11, 2024, 2:00pm to 3:00pm CST May 12, 2024, 2:00pm to 3:00pm CST
"how people leave"  by Sea Legs Dance	April 6, 2024	KMFA Classical 89.5	Sea Legs Dance presents "how people leave," an evening of contemporary dance exploring the many ways people leave and, by doing so, shape our lives. Through contemporary dance, relational stories are weaved together by the healing, growth, and transformation that grows out of absence.  Inspired by the poem “The Uses of Sorrow” by Mary Oliver.  Sea Legs Dance is a contemporary dance company based in Austin, TX. As the name implies, Sea Legs strives to adapt to the different places dance can take us through narratives and the celebration of each dancer that shapes its work.
Anni Albers: In Thread and On Paper	February 11, 2024 - June 30, 2024	Blanton Museum of Art	Anni Albers (1899–1994) is considered the most important textile artist of the 20th century. Known for her wall hangings, weavings, and designs, she was also an innovative educator and printmaker. Anni Albers: In Thread and On Paper highlights how nimbly Albers moved between mediums—including her shift from weaving to printmaking in the 1960s—and transitioned between making art and designing functional and commercial objects. In addition to Albers’s woven rugs, tapestries, drawings, and prints, the exhibition features her loom and wallpaper based on her designs. Anni Albers: In Thread and On Paper will be on view starting February 11, 2024 through June 30, 2024.
Austin Country, Folk &amp; Blues Festival	April 6, 2024	The Fieldhouse at the Crossover	Get your $5 tickets now! The famous Austin Country, Folk & Blues Festival is back: Saturday April 13, 2024 at spectacular Pfluger Park. 10 straight hours of Grammy Award, CMA Music Festival, and Billboard #1 artists performing live on stage. Plus dozens of artists and crafters, a farmers fresh market, and cold craft beer and wines. And early bird tickets are just $5 (parking is FREE). Get yours today: austincountryfestival.com/tickets  It's a beautiful day of Peace, Love & Music. See you soon!
Black Girls Don't Wear Red Lipstick	February 15, 2024 - April 21, 2024	Austin Central Library Gallery (2nd Floor)	Step into a world of audacious beauty and empowerment with the photo exhibition, Black Girls Don't Wear Red Lipstick, created by the visionary photographer, Leta Harrison, curated by Keyheira Keys and Whitney Hamilton, _OFCOLORATX.  Through images of Black women embracing vibrant colors and confidently wearing shades of red lipstick, Leta's bold photographic prints showcase women using beauty as a form of activism to reclaim their power, challenge oppressive beauty standards, and stifle stereotypes. Leta’s powerful images celebrate each woman’s uniqueness, fostering self-love, promoting positive change, and illustrating Black women breaking free from the shackles of conformity.  About the Artist Leta Harrison is a local Austin photographer with an unwavering passion for capturing the essence of her subjects and telling their powerful stories through her lens. Drawing inspiration from Texas musician, Kam Franklin's artist talk, in which she bravely shared her personal experiences of facing pressure to be more modest and being judged for her expressive style, often considered "too much", Kam's poignant recollection of the phrase, "Black girls don't wear red lipstick," struck a chord with Leta, inspiring her to further uplift the women that she photographs and to create this exhibition.  Photo credit Leta Harrison.
Austin FC vs. San Jose Earthquakes	April 6, 2024	Q2 Stadium (Austin FC)	Austin FC will take on San Jose Earthquakes on April 6th at Q2 Stadium in the MLS regular season.
Bob Dylan: The Rough And Rowdy Ways Tour	April 5, 2024 - April 6, 2024	ACL Live at The Moody Theater	Bob Dylan’s career has lasted the better part of fifty years now. That’s pretty remarkable. What is more impressive is that Dylan has remained not only active for almost all of that period, but controversial. He has never gotten by on sentimentality or nostalgia. He has never repeated his successes. For better or for worse, Dylan has always pushed his work ahead.  Join ACL Live and watch Bob Dylan's "The Rough And Rowdy Ways Tour."
BRAD UPTON	April 6, 2024 - April 7, 2024	Cap City Comedy Club	Brad Upton is Dry Bar Comedy’s most popular act with over 160 million views. He used to tour with the late, great Joan Rivers and is a past winner of the Las Vegas Comedy Festival. Don’t miss this show!!!  PLEASE NOTE: Our Balcony section for main room shows is NOT wheelchair accessible.  Sat, Apr 6, 2024  4:00 PM  Sun, Apr 7, 2024  7:00 PM
Celest Fest Eclipse	April 5, 2024 - April 9, 2024	Camp Tahuaya	Celest Fest is a family-friendly, sober festival that seeks to create a sacred and transformative experience through the power of song and dance. With a commitment to intimate gatherings and intentional curation, Celest Fest Eclipse aims to rekindle profound connections with self, community, and nature. The festival takes place from April 5th to 9th, 2024  Musical headliners include Gone Gone Beyond, YAIMA, Peia, and Alexa Sunshine Rose.
Buda's Birthday Celebration ft Shakey Graves	April 6, 2024	Buda Amphitheater & City Park	Join us as we celebrate Buda’s 143 years with a day of festivities & live music from Shakey Graves! Come down to Buda Amphitheater & City Park for live music, carnival, local food vendors, market, and a live drone show! This FREE festival is on April 6, 2024.
Color, Light &amp; Space Art Exhibition	March 30, 2024 - May 11, 2024	Stephen L. Clark Gallery	Stephen L. Clark Gallery is excited to present "Color, Light & Space" by Lance Letscher. This exhibition features new colorful, vibrant, and detailed collages and will be showing from March 30th, 2024 to May 11th, 2024.
Chris Pureka w/ Avery Marshall	April 6, 2024	Mohawk	Resound Presents: Chris Pureka w/ Avery Marshall at Mohawk on 4/6 Doors/Show: 7:00pm/8:00pm All Ages
Dave Madden's 11:59 Songwriter Showcase	April 6, 2024	The 04 Center	Dave Madden's 11:59 Songwriting Group is back with another great night of music! Come and hear some of Austin's finest songwriters performing new material for the very first time.  Line up: Akina Adderley, Amethyst Jonquille, Amy Atchley, Barbara Nesbitt, Ben Jones, Daniel Fears, Dave Madden, David Starbuckle, Erica Longoria, Giulia Millanta, Kate Priestley, Lizzie Wann, Pat Buchta, Ray Prim, & Sarah Sharp.  This unforgettable evening of music features live American sign language (ASL) interpretation by Stardust ASL. Don't miss this unique opportunity to connect with the power of music alongside Austin's vibrant deaf community. As the creator of the 11:59 Songwriting Group, Dave Madden has built an annual project designed to provide support, accountability, and feedback for a diverse group of musicians and songwriters. Every year, Madden curates a collective of artists ranging from singer-songwriters to instrumentalists, poets, visual artists, composers, solo artists, and bands. It’s a vibrant community where many genres of music are represented. Since its inception in 2018, the group has created 875 songs—and they're just getting started.
Ditte Sørensen: Threads, the Elusive &amp; Feminine	March 28, 2024 - June 2, 2024	Unchained.Art Contemporary Gallery	Threads, the Elusive & Feminine, the first US solo exhibition by Copenhagen-based Danish artist Ditte Sørensen, invites you to dive deeply into the heart of collage innovation. Known as Madstitch, her solo debut unveils the intricate world of fabric as the canvas itself, offering a profound exploration of both the tactile and intangible aspects of various mediums serving as a basis for her work.  Celebrated for her unique fusion of traditional textile techniques with a bold contemporary vision, Sørensen creates narratives that resonate deeply on personal and universal levels. Her work, characterized by an expressive, unpolished sensuality, serves as an invitation to explore the layers of human experience through the lens of fabric and collage art. Sørensen intricately balances and weaves raw narratives, touching upon the delicate intersections of identity, memory, and the essence of femininity.  The exhibition showcases an array of Sørensen's creations, including original fabric artworks, original mixed media pieces and prints. Each piece is a testament to her journey as an artist and a pioneer in the Danish art scene. Her distinctive use of freehand embroidery transforms ordinary elements into storied tapestries that speak to the viewer on multiple levels, sometimes incorporating auditory elements to deepen the sensory experience and immersion. (Follow the hidden QR codes).  At the core of Sørensen's work is an adventurous spirit, captured through her experimental approach to textiles, paper, and water-soluble fabrics on an old sewing machine. Her art is a nuanced exploration that pays acute attention to materials and detail, capturing the essence of the elusive and feminine with a subtlety that is both captivating and tactile. Her work evolved from utilizing predominantly textiles in the past to nowadays mostly paper-based techniques, which can include books, magazines, and chocolate wrappers. Sørensen does not limit herself and explores literally any material from plastic bags, dried leaves, and old pillows as basis for her distinct collages.  Immersive, expressive, distinctive, her art represents a seamless fusion of form, texture, and color, inviting us to experience the intricate world of Ditte Sørensen, where every thread weaves a narrative of the elusive and feminine, challenging us to see beyond the surface and into the depths of collaged storytelling.  opening reception: March 28 | 5 – 8pm kom mød Ditte: March 29 | 5 – 8pm coffee & snacks with Ditte: March 31 | 11 – 2pm (RSVP required - Eventbrite) third thursday: April 18 | 6 – 9pm closing event: June 1st | 5 – 8pm
Fictions More Precious	March 8, 2024 - April 20, 2024	Big Medium	Fictions More Precious features new and existing works from Rodell Warner’s Augmented Archive and Artificial Archive. In these works, the artist uses digital interventions in archival imagery to fictionalize the Caribbean’s past and interrogate the region’s photographic archive. Focusing on moments during photography’s infancy, a period shaped by the uneven power relations of colonialism, the artist interrogates, troubles, and laments the validity of the power of that archive.  Fictions More Precious runs from March 8 - April 20, 2024  Member Preview: March 8, 7-8 PM Opening Reception: March 8, 8-10 PM  Gallery Hours: Thursdays, Fridays, and Saturdays 12-6 PM
GEORGE WALLACE	April 5, 2024 - April 6, 2024	Cap City Comedy Club	By the age of six, George Wallace knew he wanted to be a comedian. He always enjoyed making people laugh, but he also knew the importance of an education. He attended the University of Akron, Ohio, and upon graduating with degrees in Transportation, Marketing/Advertising, plus advanced studies in Radio and Television from Columbia School of Broadcasting. Literally, a rags-to-riches story, Wallace went from selling rags to VP of Advertising. Still, his dream of being a comedian had a strong hold on him. Within a week of leaving the advertising field, he began to perform stand-up comedy and was offered a job writing for “The Redd Foxx Show.”  Wallace is currently pursuing dual coursework at the University of Phoenix and DeVry. With his writing and stand-up experience, Wallace began landing television appearances.  Wallace was awarded a Lifetime Achievement Award at the 2013 Soul Train/Centric Comedy All-Star Awards; and won Best Stand-Up Comedian at the prestigious American Comedy Awards after four consecutive nominations. As a veteran radio personality, he has also made appearances on “The Steve Harvey Morning Show” and is a charter member of “The Tom Joyner Morning Show.” In 2004 Wallace appeared as the headlining star of his own show at The Flamingo Hotel in Las Vegas for a 30-day run. Sin City showed its admiration by extending Wallace’s contract indefinitely and nicknaming him “The New Mr. Vegas.” Unlike any other comedy show in Las Vegas, Wallace gave away a number of prizes every night including CDs, DVDs, diamond necklaces, dinner at prestigious restaurants, gourmet chocolates, tropical cruises, and even a new car. He celebrated his 10th Anniversary headlining at the Flamingo in March 2014, and announced he was closing the show to head back out on the road.  Wallace regularly performs in comedy clubs across the country and is an ambassador for the United States government, performing at military bases all over the world.  His first book, "LAFF IT OFF" (Chaite Press) was published in 2014. A tome of life wisdom, humor and insight from a lifetime of observation, the book is in its third printing.  Wallace’s most recognized material is his “I Be Thinkin’” lines and jokes about everything from conversational thoughts to political aspirations. Each show he engages members of the audience in comical banter. If provoked, he might even throw out a few of his signature “Yo Mama” jokes. He shows his gratitude to the audience by signing autographs and taking photos after every show.  PLEASE NOTE: Our Balcony section for main room shows is NOT wheelchair accessible.  Fri, Apr 5, 2024  7:00 PM 9:30 PM  Sat, Apr 6, 2024  7:00 PM 9:30 PM
Ghost Tour and Paranormal Investigation	4/6/2024, 4/20/2024, 5/4/2024, 5/18/2024	Jourdan-Bachman Pioneer Farms	Complete after-hours private access to the 90-acre living history museum. This is a full immersion paranormal investigation and tour. Each location has a unique history as told by the spirits who remain to tell their stories. There are over 20 buildings throughout the farm including a church, dancehall, 1840's farmhouse and the Chisholm Trail. This is an outdoor event dress for the weather. 50% of ticket sales go to preserving Austin's history on the farm.
HONK!TX 2024	4/5/2024, 4/6/2024, 4/7/2024	Multiple Locations Across Austin	HONK!TX is a free, three-day, family-friendly festival of brass street bands. Bands from all across the continent come to Austin to perform for free in public spaces. Mobile and unamplified, HONK! bands dissolve the distance between performer and audience, while sharing street music traditions from diverse global cultures.  Friday, April 5, from 6-10pm at Central Machine Work Saturday, April 6, from noon to 6pm at multiple locations throughout Mueller Lake Park Sunday, April 7, noon to 5 at Pan Am Park
