TITLE	DATES	LOCATION	DESCRIPTION
Tuesday Twilights	March 19, 2024 - May 14, 2024	Lady Bird Johnson Wildflower Center	We’re staying open late every Tuesday, March 19 – May 14, to make more hours for wildflowers! Make it a date night, a picnic with friends, or come for some solo solace in nature. Each evening will feature live music from local musicians, a rolling lineup of Austin’s favorite food trucks, and take-and-walk adult beverages for purchase. More details coming soon!  Tuesday Twilights is included with regular garden admission. Reservations are encouraged and become available seven days in advance.
Anni Albers: In Thread and On Paper	February 11, 2024 - June 30, 2024	Blanton Museum of Art	Anni Albers (1899–1994) is considered the most important textile artist of the 20th century. Known for her wall hangings, weavings, and designs, she was also an innovative educator and printmaker. Anni Albers: In Thread and On Paper highlights how nimbly Albers moved between mediums—including her shift from weaving to printmaking in the 1960s—and transitioned between making art and designing functional and commercial objects. In addition to Albers’s woven rugs, tapestries, drawings, and prints, the exhibition features her loom and wallpaper based on her designs. Anni Albers: In Thread and On Paper will be on view starting February 11, 2024 through June 30, 2024.
Austin Facilitation Meetup with Voltage Control	March 26, 2024	Palm Venture Studios	Join us for an immersive evening of hands-on facilitation exploration at the Practice Playground, hosted by Douglas Ferguson and Erin Warner. Dive into a diverse array of facilitation methods, from traditional approaches to cutting-edge strategies. Our environment is carefully crafted to be safe, supportive, and conducive to growth, allowing you to step out of your comfort zone, try new tactics, and build confidence in your facilitation abilities.  - Impromptu Networking: Connect with fellow community members and expand your network. - Idea Marketplace & Voting: Share your practice areas and vote on the top opportunities for growth. - Practice & Role Play: Take turns facilitating methods or participate in group role-playing scenarios. - Reflect, Debrief, & Commit: Wrap up the evening with reflection, group debriefing, and individual commitments.  Don't miss this chance to level up your facilitation skills and join a vibrant community of like-minded professionals. Reserve your spot today for an evening of learning, growth, and collaboration!
Black Girls Don't Wear Red Lipstick	February 15, 2024 - April 21, 2024	Austin Central Library Gallery (2nd Floor)	Step into a world of audacious beauty and empowerment with the photo exhibition, Black Girls Don't Wear Red Lipstick, created by the visionary photographer, Leta Harrison, curated by Keyheira Keys and Whitney Hamilton, _OFCOLORATX.  Through images of Black women embracing vibrant colors and confidently wearing shades of red lipstick, Leta's bold photographic prints showcase women using beauty as a form of activism to reclaim their power, challenge oppressive beauty standards, and stifle stereotypes. Leta’s powerful images celebrate each woman’s uniqueness, fostering self-love, promoting positive change, and illustrating Black women breaking free from the shackles of conformity.  About the Artist Leta Harrison is a local Austin photographer with an unwavering passion for capturing the essence of her subjects and telling their powerful stories through her lens. Drawing inspiration from Texas musician, Kam Franklin's artist talk, in which she bravely shared her personal experiences of facing pressure to be more modest and being judged for her expressive style, often considered "too much", Kam's poignant recollection of the phrase, "Black girls don't wear red lipstick," struck a chord with Leta, inspiring her to further uplift the women that she photographs and to create this exhibition.  Photo credit Leta Harrison.
Beat Case +	January 30, 2024 - March 26, 2024	Dadalab	Beat Case +  Weekly open media from 7-9pm hosted by Dr. Bobby Banner, MPC with curated performances from 9-11pm. Come by hang out, have a drink. It's free and open to anyone at any level. Bring your visual art, media art, raps, beats, or dance. Even if you're bored and want something to do, our visual wall at Dadalab is a feast, so if you're just visiting Austin, come peep the best venue in town.
Broadway in Austin: Wicked	March 13, 2024 - March 31, 2024	Bass Concert Hall - PAC (Performing Arts Center)	WICKED, the Broadway sensation, looks at what happened in the Land of Oz…but from a different angle. Long before Dorothy arrives, there is another young woman, born with emerald-green skin—smart, fiery, misunderstood, and possessing an extraordinary talent. When she meets a bubbly blonde who is exceptionally popular, their initial rivalry turns into the unlikeliest of friendships…until the world decides to call one “good,” and the other one “wicked.”  From the first electrifying note to the final breathtaking moment, WICKED—the untold true story of the Witches of Oz—transfixes audiences with its wildly inventive story that USA Today cheers is “a complete triumph! An original musical that will make you laugh, cry, and think.”
Feasts in the Field	March 25, 2024 - March 26, 2024	Rancho Pillow	Coinciding with the bi-annual and globally renowned Round Top Antiques Fair, Rancho Pillow founder Sheila Youngblood and her team will host a series of family-style dinners for upwards of 200 guests, marrying Sheila's passions for great food, storytelling, connection, and creativity.  Each season, chefs from around the country are invited to cook while Sheila sets the tables with treasures from the property, its surrounding nature, and the nearby fair, and welcomes guests who have spent the day shopping in the fields to enjoy a meal, make new friends, and share stories under the stars.  This season, Sheila has partnered with Venezuelan-born, Los Angeles-based chef, artist, and owner of Chainsaw, Karla Subero Pittol for the limited menu.  At Chainsaw, you can find the roving chef’s daring return to old school outdoor cooking: open flame, controlled coals, and fire charred produce and proteins dominate the menu and work in tandem with her love of citrus, chiles and fresh herbs. She is excited to bring her unique approach and unparalleled flavors to the fields for two nights only.
Hope for Spring: Texas Water	March 20, 2024 - April 28, 2024	Neill-Cochran House Museum	Spring has returned to the Neill-Cochran House Museum, and with it the fourth annual Hope for Spring exhibition. As we step into spring, Texans begin to hear the call of the beautiful Texas waters from Austin’s Barton Springs Pool to Caddo Lake State Park, all the way to the beaches of Galveston. Whether it’s strolling along the San Antonio River Walk, tubing down the Comal River, or casting a fishing line off the pier in South Padre, Texans will always be pulled towards the water as we march towards the warmer months. Hope for Spring: Texas Water is our celebration of Texas water, and how it revitalizes not only us, but the land around us.  IMPORTANT DATES: Show Dates: Opens March 20th-April 28th Opening Reception: Saturday, March 23rd (free event) Hope for Spring Art on the Lawn: Sunday, April 14th, 11-3pm *This is an exclusive Art on the Lawn specifically for Hope for Spring participating artists.  Hope for Spring: Texas Water will be on display throughout the historic house museum embedded among the NCHM Collection. The exhibition is included with NCHM general admission. Learn more here: https://www.nchmuseum.org/hope-for-spring-texas-water
Haley Blais	March 26, 2024	Mohawk	Resound Presents: Haley Blais at Mohawk on 3/26 Doors/Show: 7:30pm/8:30pm All Ages
Injury Prevention and Strenghtening Master Classes	March 19, 2024 - August 27, 2024	Cafe Dance	Join Shakti Moves Dance Company for an hour adult ballet class. Taught by Emily Karnes, get a full range of exercises to keep you moving, breathing and laughing! All levels welcome. Get moving ! Align! Thrive! $30/class register and pay online @www.shaktimovesdc.org/community
Julia C. Butridge Gallery Exhibit: Off The Clock	February 3, 2024 - March 30, 2024	Dougherty Arts Center	On display at the Julia C. Butridge Gallery, the exhibit "Off The Clock" a group exhibition of artworks by the Dougherty Arts Center's staff.  Off The Clock invites you to explore the creativity that defines Dougherty Arts Center’s talented team. From vivid brushstrokes to digital masterpieces, each piece offers a glimpse into the imaginative minds that contribute to our dynamic workplace, revealing the unique perspectives and artistic endeavors that flourish within our community. As you wander through the gallery, discover the depth of talent and inspiration that fuels our collective spirit and propels us forward. Join us in recognizing the dedication, passion, and creativity that makes Dougherty staff truly exceptional.
Julia C. Butridge Gallery Exhibit: Scent of Austin	March 23, 2024 - April 20, 2024	Dougherty Arts Center	On display at the Julia C. Butridge Gallery the exhibit "Scent of Austin" photographic artwork by artist Ziesook You.  Ziesook incorporates symbolism inspired by Broq-pa floral traditions to capture intimate, multi-layered portraits. She began working with this theme in 2016, taking photos of her twin daughters, and has since expanded her subjects to include single mothers, seniors, and people with multi-cultural backgrounds. Since moving to Austin two years ago, Ziesook has begun work on her “Scent of Austin” series, utilizing flora and fauna from central Texas in her photographs of Austinites.  The City of Austin is committed to compliance with the Americans with Disabilities Act. Reasonable modifications and equal access to communications will be provided upon request. For assistance please contact (512) 974-3914 or Relay Texas 7-1-1
Legacies of the Treaty of Guadalupe Hidalgo Exhibition	February 16, 2024 - May 16, 2025	Bullock Texas State History Museum	Explore the short-term and long-term impacts of the Treaty of Guadalupe Hidalgo through artifacts, documents, artworks, and media.  Featuring 29 artifacts, the special focus exhibit, located in the Statehood Gallery on the Second Floor of the Texas History Gallery, explores the short-term and long-term impacts of the Treaty of Guadalupe Hidalgo on Texas, the United States, Mexico, and Tribal Nations.  At the heart of the exhibit is the Treaty itself, a document that established the border between Texas and Mexico at the Rio Grande and ceded over half of Mexico's northernmost lands to the United States. Don't miss the handwritten pages of the Treaty of Guadalupe Hidalgo, on loan from the National Archives and Records Administration in Washington, D.C.
March Madness	March 19, 2024 - March 31, 2024	Meanwhile Brewing Co.	Looking for somewhere to watch the March Madness games? Make that somewhere Meanwhile!⁠ We're taking a pause on our concerts for the next couple of weeks to show games on our big outdoor screen.⁠ Come early to claim your spot. We'll see you soon! Follow @meanwhilebeer on Instagram or check out meanwhilebeer.com to stay updated!
Music America: Iconic Objects from America's Music History Exhibit	February 17, 2024 - August 11, 2024	LBJ Presidential Library	Music America exhibit debuts at the LBJ Presidential Library and is on display from February 17 - August 11, 2024. This new exhibit features more than 100 iconic objects from America's music history. The LBJ Presidential Library and the Bruce Springsteen Archives & Center for American Music invite you to explore the exhibit "Music America: Iconic Objects from America's Music History," on display at the LBJ Library.  The Library is open daily from 9 – 5. Last visitor admitted at 4 pm.  "Music America" features instruments, hand-written original lyrics, books, photographs, costumes and other objects from major artists performing in all walks of American music in different decades and tells the story of those artists who contributed to it. Visitors will be able to see artifacts from Texas artists Buddy Holly, Janis Joplin, Stevie Ray Vaughan and Willie Nelson as well as national performers B.B. King, Billie Holiday, Bob Dylan, Carlos Santana, Ella Fitzgerald, Elvis Presley, Frank Sinatra, Jimi Hendrix, Johnny Cash, Lead Belly, Sam Cooke, Whitney Houston, and more.  "Music America" is curated by the Bruce Springsteen Archives & Center for American Music in association with the Rock & Roll Hall of Fame and Museum, New Orleans Jazz Museum, Hard Rock International and other institutions nationwide.
Red Dress Exhibition	March 9, 2024 - April 6, 2024	George Washington Carver Museum, Cultural & Genealogy Center	We Ride For Her team will host several events during the festival’s run. On Saturday, March 9, the Medicine Wheel Riders will embark on a Medicine Wheel Ride through Austin on motorcycles lent by Harley-Davidson®, departing at 12:30pm from Cowboy Harley-Davidson® of Austin.  The ride will end at 4:30pm at The George Washington Carver Museum and Cultural Center, where the team behind We Ride For Her has organized a Red Dress Exhibition, featuring empty red dresses hanging through the museum’s lobby as a visual representation of the spirits of missing and murdered Indigenous women, girls, and 2Spirit individuals, inspired by the work of Métis artist Jaime Black. Upon the culmination of the ride at the museum, the community will celebrate the exhibition’s opening with a reception and remarks. The Red Dress Exhibition will remain open to the public from March 9 through April 6, 2024.  On Sunday, March 10, at 3:00 PM, following the film’s premiere, Level Forward will present a conversation at the The George Washington Carver Museum, ignited by the topics and themes of We Ride For Her. This event will excavate and amplify the roots of Black, Brown, and Indigenous solidarity as well as uplift the community ownership model deployed by We Ride For Her, centering equity, transparency, and wealth sharing. RSVP here for the panel.
Open Mic Night	February 20, 2024 - April 9, 2024	Cap City Comedy Club	See the best local comics at Cap City Comedy Club's Open Mic Night! SIGN UP HERE!  Open Mics are on Tuesdays unless otherwise noted on our calendar here. In the event that there is an event happening in the main showroom, Open Mic will take place in The Red Room  PLEASE NOTE: Our Balcony section for main room shows is NOT wheelchair accessible.
Songwriters’ Open Mic	January 30, 2024 - April 30, 2024	Cactus Cafe	Admission is free! Doors open at 7 p.m., show begins at 7:30 p.m. Join us every Tuesday to hear all original music (no covers allowed!) from talented local artists on the famed Cactus stage.  We hope you’ll join us for a drink and show at the best listening room in Austin!  Interested in performing? Contact Jake Farr at jakefarrmusic@gmail.com.
The Floating World Exhibit	February 11, 2024 - June 30, 2024	Blanton Museum of Art	After centuries of conflict and war, Japan’s Edo period (1603–1868) was a time of peace, stability, and economic growth. Enjoy more than 130 woodblock prints and painted scrolls from one of history’s most vibrant artistic eras.  These “pictures of the floating world” depict the lifestyle, pleasures, and interests of the urban population— from samurais, geishas, and kabuki actors to boat parties, palaces, and lush landscapes.  Not to be missed, this presentation marks the first time the Worcester Art Museum is touring its famed collection of Japanese artworks. The Floating World: Masterpieces of Edo Japan from the Worcester Art Museum will be on view starting February 11, 2024 through June 30, 2024.
The Snuts	March 26, 2024	Empire Control Room & Garage	Live Nation & Resound Present: The Snuts at Empire Control Room on 3/26 Doors 7:30pm / Show 8:30pm  All Ages
Two Births and the Afterlife Exhibit	January 11, 2024 - April 20, 2024	George Washington Carver Museum, Cultural & Genealogy Center	Two Births and the Afterlife features a new body of work by Milwaukee-based artist Aimée M. Everett, exploring the profound transformations experienced during childbirth and the subsequent journey of self-discovery into motherhood. The artist delves into the poignant realization that with every birth, there exists a simultaneous death—the departure of one's former identity to welcome a new, evolved self. Everett vividly portrays the overwhelming joy and simultaneous dissolution of familiar aspects of identity. This body of work—employing abstraction, minimalistic line-making, saturated colors, and melodic compositions—serves as an emotional odyssey.    The months following the birth unfolded into a challenging transition period.
Youth Art Month	February 26, 2024 - March 30, 2024	Bullock Texas State History Museum	March is Youth Art Month, a nationally recognized program that emphasizes the value of art education for all children, encourages support for quality school art programs, and promotes the importance of art appreciation for all people. Sponsored in Texas by the Texas Art Education Association (TAEA), the state has been a leader in Youth Art Month celebrations since the program began in 1961.  Throughout the month of March, the Museum's Third Floor Rotunda is home to an exhibition of over 100 original pieces of student artwork created by K-12 students from across the state. Visitors will enjoy an exhibit that showcases the talents and self-expression of the students of Texas.
Clyde Littlefield Texas Relays	March 27, 2024 - March 30, 2024	Mike A. Myers Track & Soccer Stadium	The premier track & field event brings together the best high school, college and professional athletes from Texas, the U.S. and the world.  Every year, the Texas Relays brings in some of the nation's top talent in the high school, collegiate and professional ranks. Accepted entries and a full meet schedule will be announced closer to the competition.
Alejandro Meola	March 27, 2024	Carousel Lounge	Alejandro Meola presents new album "VIVO" live in Austin next Wednesday, March 27th with a matinee set 5 to 7pm at Carousel Lounge, 1110 E 52nd St. FREE admission, no cover event, $15 suggested donation for independent touring artist.  The show is part of a tour with three other concerts scheduled in Texas. Alejandro Meola is an argentine-american singer, songwriter and guitarist based in the New York City area since 2013. With a prolific and eclectic catalog rooted in Rock/Blues the songwriter has performed extensively across the US and Europe.
Anni Albers: In Thread and On Paper	February 11, 2024 - June 30, 2024	Blanton Museum of Art	Anni Albers (1899–1994) is considered the most important textile artist of the 20th century. Known for her wall hangings, weavings, and designs, she was also an innovative educator and printmaker. Anni Albers: In Thread and On Paper highlights how nimbly Albers moved between mediums—including her shift from weaving to printmaking in the 1960s—and transitioned between making art and designing functional and commercial objects. In addition to Albers’s woven rugs, tapestries, drawings, and prints, the exhibition features her loom and wallpaper based on her designs. Anni Albers: In Thread and On Paper will be on view starting February 11, 2024 through June 30, 2024.
Black Girls Don't Wear Red Lipstick	February 15, 2024 - April 21, 2024	Austin Central Library Gallery (2nd Floor)	Step into a world of audacious beauty and empowerment with the photo exhibition, Black Girls Don't Wear Red Lipstick, created by the visionary photographer, Leta Harrison, curated by Keyheira Keys and Whitney Hamilton, _OFCOLORATX.  Through images of Black women embracing vibrant colors and confidently wearing shades of red lipstick, Leta's bold photographic prints showcase women using beauty as a form of activism to reclaim their power, challenge oppressive beauty standards, and stifle stereotypes. Leta’s powerful images celebrate each woman’s uniqueness, fostering self-love, promoting positive change, and illustrating Black women breaking free from the shackles of conformity.  About the Artist Leta Harrison is a local Austin photographer with an unwavering passion for capturing the essence of her subjects and telling their powerful stories through her lens. Drawing inspiration from Texas musician, Kam Franklin's artist talk, in which she bravely shared her personal experiences of facing pressure to be more modest and being judged for her expressive style, often considered "too much", Kam's poignant recollection of the phrase, "Black girls don't wear red lipstick," struck a chord with Leta, inspiring her to further uplift the women that she photographs and to create this exhibition.  Photo credit Leta Harrison.
Artist Reception for "Scent of Austin"	March 27, 2024	Dougherty Arts Center	Join us at the Julia C. Butridge Gallery located within the Dougherty Arts Center for the Artist Reception for "Scent of Austin" an exhibit of artworks by Ziesook You. Ziesook incorporates symbolism inspired by Broq-pa floral traditions to capture intimate, multi-layered portraits. She began working with this theme in 2016, taking photos of her twin daughters, and has since expanded her subjects to include single mothers, seniors, and people with multi-cultural backgrounds. Since moving to Austin two years ago, Ziesook has begun work on her “Scent of Austin” series, utilizing flora and fauna from central Texas in her photographs of Austinites.  All Julia C. Butridge Gallery events are free and open to all.  The City of Austin is committed to compliance with the Americans with Disabilities Act. Reasonable modifications and equal access to communications will be provided upon request. For assistance please contact (512) 974-3914 or Relay Texas 7-1-1.
Bourbon and Blues	July 5, 2023 - October 2, 2024	Still Austin Whiskey Co.	Austin's up and coming artists playing the patio every other Wednesday - FREE SHOW 7pm - 9pm
Broadway in Austin: Wicked	March 13, 2024 - March 31, 2024	Bass Concert Hall - PAC (Performing Arts Center)	WICKED, the Broadway sensation, looks at what happened in the Land of Oz…but from a different angle. Long before Dorothy arrives, there is another young woman, born with emerald-green skin—smart, fiery, misunderstood, and possessing an extraordinary talent. When she meets a bubbly blonde who is exceptionally popular, their initial rivalry turns into the unlikeliest of friendships…until the world decides to call one “good,” and the other one “wicked.”  From the first electrifying note to the final breathtaking moment, WICKED—the untold true story of the Witches of Oz—transfixes audiences with its wildly inventive story that USA Today cheers is “a complete triumph! An original musical that will make you laugh, cry, and think.”
Candlelight: From Bach to The Beatles	March 27, 2024	AFS Cinema	Candlelight concerts bring the magic of a live, multi-sensory musical experience to awe-inspiring locations like never seen before in Austin. Get your tickets now to discover the music of From Bach to The Beatles at AFS Cinema under the gentle glow of candlelight.  General Info 📍 Venue: AFS Cinema 📅 Dates and times: select your dates/times directly in the ticket selector ⏳ Duration: 60 minutes (doors open 45 mins prior to the start time and late entry is not permitted) 👤 Age requirement: 8 years old or older. Anyone under the age of 16 must be accompanied by an adult ♿ Accessibility: this venue is ADA compliant ❓ View the FAQs for this event here 🪑 Seating is assigned on a first come first served basis in each zone 🕯️ If you would like to book a private concert (min 15+ people), please click here 🎻 Check out all the Candlelight concerts in Austin 🎁 To treat your friends and family to a Candlelight gift card, click here  Tentative Program: Bach: Brandenburg Concerto No. 3 in G Major, BWV 1048: I. Allegro Cello Suite No. 1 in G Major, BWV 1007: I. Prelude Ave Maria (Bach / Gounod) Concerto for 2 Violins in D Minor, BWV 1043: I. Vivace  The Beatles: I Want to Hold Your Hand Yesterday Blackbird Strawberry Fields Forever & more
